kor_full,no,title,year
"제7차 교육과정 개정에 따른 교과서 교재 개발에 관한 연구 -중학교 컴퓨터 교과를 중심으로   하루가 다르게 발전, 변모해 가는 정보사회에서 컴퓨터소양 및 정보소양 교육을 담당하고 있는 컴퓨터 교육의 역할은 현행 교육체제에서 그 중요성이 점차 커지고 있다. 2001학년도부터 중학교에서 시작되는 제7차 교육과정은 ‘정보 사회 적응력 함양 교육’을 목표로 지금까지와는 다른 컴퓨터 교육의 체계와 내용을 제시하고 있다. 이에 따라 본 고에서는 제 6, 7차 컴퓨터 교과 중학교 교육과정을 비교, 컴퓨터 교육의 패러다임 변화를 분석하며, 제7차 교육과정에 따른 교과서 교재 개발을 위하여 교재 개발 지침, 내용 전개 및 구성, 다양한 학습방법에 따른 교수-학습의 가능성 검토, 다양한 평가 방법에 의한 학업 성취도 평가를 중심으로 그 가능성을 모색, 제언하고자 한다.",113.0,제7차 교육과정 개정에 따른 교과서 교재 개발에 관한 연구 -중학교 컴퓨터 교과를 중심으로,2001.0
"웹을 기반으로 한 자기 주도적 천문학 학습 프로그램 개발   웹을 활용하여 지식과 정보를 학습자가 자율적으로 수집, 활용하여 독자성과 창조성을 기를 수 있는 자기 주도적 학습 프로그램이 필요하다. 따라서 우리 생활과 밀접한 관련이 있으나 실제로 관찰하기에는 어려움이 있는 천문학 내용을 동적 애니메이션을 이용하여 학습자가 흥미를 가지고 보다 쉽게 학습할 수 있도록 한다. 한편, 문제은행을 통하여 학습자가 스스로 학습한 내용을 평가하고자 하며 학습 내용과 관련된 일상 생활에서의 실험․관찰 주제를 제시하여 학습자가 학습 내용을 실생활에서도 친숙하게 받아들일 수 있게 하고자 한다.",114.0,웹을 기반으로 한 자기 주도적 천문학 학습 프로그램 개발,2001.0
"통합사고모형에 기반한 효율적 ICT 활용 전략   최근 국내 교육계의 최대 관심인 ICT 활용 교육은 활용 측면이 지나치게 강조되고 있고, ICT 활용 교육에 대한 연구도 실용적인 측면만이 부각됨에 따라 기능적인 활용으로 치우칠 수 있다는 우려를 낳고 있다. 본 연구는 이에 대한 대안으로서 ICT 활용을 이론적 차원에서 모색하여 효율적인 ICT 활용을 위한 구체적인 전략을 마련하고자 하였다. 먼저, 효율적 ICT 활용의 개념을 정의하였고, 전략 도출을 위한 기초 준거로 인간의 고등 사고를 설정하여 비판적 사고를 포함한 Iowa 교육부의 통합 사고 모형을 분석하였다. 이를 통해 효율적 ICT 활용을 위한 종합적 사고를 범주화하였다. 또한, 효율적 활용을 위한 ICT를 소프트웨어, 하드웨어, 활용 기술 영역으로 분류하여 각각의 개념과 상호 관계를 살펴보았다. 이렇게 분류한 ICT의 각 영역과 종합적 사고 범주와의 관련성을 규명하기 위해 ‘사고 영역과 ICT 영역간의 관련성 결정 준거’를 논의하였고, 이를 구체화한 ‘ICT-EUS 도출을 위한 분석 매트릭스’를 설정하여, 도출 과정의 타당성과 도출 결과의 명확성을 확보하고자 하였다. 이와 같은 과정을 통해 최종적으로 ICT의 영역 중 학습 자원, 학습 도구, 학습자, 탐색, 의사소통, 생산, 표현에 대한 ICT-EUS(Efficient-Use Strategy of ICT; 효율적 ICT 활용 전략)를 도출하였다. ICT-EUS는 ICT의 단순한 활용을 넘어서 학습 자원, 도구, 활용 기술 등에 대한 인지적 해석을 통해 학습 목표 달성의 효율성과 효과성을 제고할 수 있는 가능성을 제공할 수 있을 것으로 기대한다.",115.0,통합사고모형에 기반한 효율적 ICT 활용 전략,2001.0
"학교 교육정보화 현황 및 개선 방안 연구 -경기도 지역을 중심으로-   본 연구에서는 경기도 교육정보화 현황을 파악, 분석하여 이를 토대로 향후 교육정보화의 방향 및 갖추어야 할 제반 여건에 대해 제안하고자 한다. 경기도 교육정보화 현황 조사결과, 정보화 물적 기반 구축에 비해 교수-학습에의 활용은 낮은 것으로 나타났다. 또한, 보급된 기자재의 급속한 노후화 및 관리운영의 비용문제, 우수 교육용 컨텐츠의 개발 저조 및 미비한 보급체제 등이 문제점으로 지적되었다. 이러한 조사결과를 토대로, 교육정보화 정책에 실질적인 도움을 줄 수 있는 추진방향을 다음의 4가지 영역으로 세분화하여 제안하였다: 효율적 교육 정보화 물적 기반 구축; 우수 교육자료 개발 및 보급; 효율적 교원 정보화연수; 및 교육정보화 정착을 위한 운영 지원. ",116.0,학교 교육정보화 현황 및 개선 방안 연구 -경기도 지역을 중심으로-,2001.0
"의사결정규칙을 이용한 아동의 교육용 인터넷 게임 활용실태 분석   인터넷 게임은 인터넷의 등장과 함께 급속하게 보급된 형태로 사용자가 이용하기 쉽고 게임의 종류가 다양하고 재미있다는 점에서 현재 학교현장에서 실시되고 있는 ICT 교육에 효과적인 교육방법으로 응용될 수 있다. 따라서, 본 연구에서는 ICT 교육에 활용될 수 있는 여러 자원 중 인터넷 게임에 대하여 아동들의 인터넷 게임 사용실태를 분석하고, 데이터 마이닝의 의사결정나무를 통하여 아동의 컴퓨터 사용에 따른 인터넷 게임에 대한 패턴을 도출하며, 또한 교사들의 활용실태를 조사함으로써 인터넷 게임 개발 필요성과 이를 초등 ICT 교육에 보다 효과적으로 적용할 수 있는 실증적 방향을 제시하였다. ",117.0,의사결정규칙을 이용한 아동의 교육용 인터넷 게임 활용실태 분석,2001.0
"사회과 교수-학습 방법에서 ICT를 활용한 수행평가 처리 시스템 개발   정보화시대의 사회에서 교수학습활동의 질을 개선하고 창의성이나 문제해결력 등 고등사고 기능을 신장시키기 위해 질적평가인 수행평가의 필요성이 대두되고 있으나 교육현장의 실정으로는 진정한 의미의 수행평가에 대한 부담과 어려움이 있다. 따라서 본 논문에서는 수업의 한 과정으로서 평가가 이루어질 수 있도록 본 평가 시스템을 설계 및 구현한다. 즉, 수행평가의 이론적인 조사와 평가 유형 및 사회과 교수학습 방법을 검토하고, 각 모형에 적절한 수행평가 방법을 알아본다. 그 중 사회과에서 가장 널리 활용되고 있는 수행평가 방법중의 하나인 보고서를 중심으로 기본 보고서 양식을 만들고, 이를 활용한 평가 시스템을 설계 및 구현한다.  평가 시스템은 크게 교사 모듈과 학습자 모듈로 구성되었고, 교사 모듈에서는 보고서 양식을 작성하여 학생들에게 제공 및 제출된 보고서를 평가한다. 학습자 모듈에서는 보고서를 작성하여 교사에게 제출하고 자신이 작성한 보고서를 수업시간에 발표하는데 활용할 수 있게 하였다.  따라서 교사는 이미 작성된 보고서를 활용하거나, 스스로 보고서 양식을 작성하여 제시할 수 있으며, 제출된 보고서를 평가한다. 아동은 평가 결과를 확인할 수 있을 뿐 만 아니라 기존의 발표 형식에서 벗어나 ICT를 활용해 발표를 할 수 있다.",118.0,사회과 교수-학습 방법에서 ICT를 활용한 수행평가 처리 시스템 개발,2001.0
"실시간 네트웍 감시시스템(NetCop)의 설계 및 구현   최근 들어 네트웍 관리 및 컴퓨터 교육의 효율을 높이기 위한 실시간 네트웍 감시 시스템에 대한 연구의 필요가 절실히 요구되고 있다. 이러한 추세에 따라 본 연구에서는 새로운 실시간 네트웍 감시 시스템을 연구 및 개발하였다. 먼저 본 시스템은 학내 망 같은 분야의 전산 수업 시 학생들의 컴퓨터를 관리, 감독할 수 있으며 학생들의 키보드나 마우스의 제어권을 획득하여 수업 시 학생들과 1 대 1 교육을 시킬 수 있다. 또한 수업 시 효율적인 전산실습 및 교육을 위해 그것의 성능을 저해하는 사용자의 유무를 체크하고 경고 메시지 및 허용되지 않은 프로그램의 실행 방지 등 사용자의 편리를 위해 제공․비치된 컴퓨터나 어떤 형태로든지 네트웍 망에 연결된 단말기의 사용범위를 실시간으로 감시, 제어 및 관리할 수 있는 기능을 제공한다. 또한 본 시스템으로 인해 네트웍 사용의 낭비를 막을 수 있고 더 나아가 컴퓨터 교육의 질을 높일 수 있으며 사용자에 더 효율적인 교육 환경을 제공할 수 있는 장점이 있다.",119.0,실시간 네트웍 감시시스템(NetCop)의 설계 및 구현,2001.0
"교내 인터넷 장비 및 PC 자원 관리를 위한 통합 관리 시스템의 설계 및 구현   이 논문에서는 초중등학교의 PC와 통신 장비에 대한 운영을 종합적으로 관리하기 위한 통합 관리 시스템을 설계하고 구현하였다. 제안된 시스템은 PC의 시스템 정보 관리, 네트워크 정보 관리, 원격관리 등의 기능과 라우터의 회선 관리 및 성능분석 기능을 제공한다. PC 관리를 위한 시스템 및 네트워크 구성 정보 모니터링이 가능하며, 원격 PC의 화면을 수집하여 현 상황 파악이 가능하다. 네트워크 장비의 관리를 위해 SNMP를 이용한 회선 인터페이스 정보 수집과 폴링에 의한 이용률 등의 분석 기능을 제공하고 있다. 통합 관리 시스템을 통해 시스템 관리 교사가 PC및 네트워크 요소에 대한 자원 정보 수집과 모니터링이 가능하여 학교 내 모든 전산 자원에 대해서 일괄 관리가 가능하다.",120.0,교내 인터넷 장비 및 PC 자원 관리를 위한 통합 관리 시스템의 설계 및 구현,2001.0
다중 학습자 상호작용을 위한 웹기반 실시간 퀴즈학습 시스템의 설계 및 구현   기존의 웹기반 교육의 시스템은 학습자들간의 상호작용을 이루어 내지 못하고 있었다. 이러한 대안으로 다중의 학습자 상호작용을 위한 시스템들이 개발되었다. 현재 이러한 시스템은 웹기반 교육분야에도 널리 활용이 되고 있는 실정이다. 그러나 현재 이루어지고 있는 다중 학습자들간의 상호작용과 피드백은 실제적으로 많은 시간차를 염두 해 두고 있어 그 효과와 신뢰성이 매우 낮은 편이다. 이러한 문제에 대한 해결책으로 본 연구에서는 실시간으로 다중의 학습자가 서로의 의견을 교환하며 상호작용을 할 수 있는 시스템을 개발하고자 한다. 또한 퀴즈학습이라는 게임형 웹기반 교육과 접목시켜 학습자의 문제해결 과정 안에서 이러한 상호작용을 이끌어 내어 학습자에게 학습의 집중도와 흥미를 유발하고 학습 효과의 극대화를 기대할 수 있다. 이에 본 연구에서는 다중 학습자 상호작용을 위한 웹기반 실시간 퀴즈학습 시스템을 설계하고 구현한다.,121.0,다중 학습자 상호작용을 위한 웹기반 실시간 퀴즈학습 시스템의 설계 및 구현,2001.0
"교과교육학으로서 컴퓨터교육학의 체제와 방향   컴퓨터교육학의 학문적 정체성을 확립하는 것은 컴퓨터교육 연구에 이론적 기반을 제공하는 매우 중요한 일이다. 또한 교과 지식과 교육 방법이 서로 유리되어 겉돌고 있는 교육 현상을 바로잡고, 학교 현장에서의 컴퓨터교육의 질적 개선에 기여를 할 수 있을 것이다. 이러한 관점에서 본 연구에서는 지식정보사회와 교육, 지식과 정보 그리고 ICT의 관계에 대한 논의를 통해 컴퓨터교육의 필요성과 방향을 탐색하였다. 또한, 교과의 개념에 대한 논의를 통해 컴퓨터교과의 개념을 탐색하였다. 아울러, 교과교육학의 개념, 전제와 구성 요소를 살펴보고 교과교육학으로서 컴퓨터교육학의 체제와 방향을 도출하였다.",122.0,교과교육학으로서 컴퓨터교육학의 체제와 방향,2001.0
"웹 기반 상담시스템의 설계와 적용   본 논문에서는 초등학생들이 솔직하고 부담 없이 자신의 고민을 상담하고 도움을 받을 수 있는 웹 기반 상담시스템을 설계 및 적용한다. 본 사이버 상담시스템의 특징은 내담자와 활발한 상호작용이 이루어지도록 하고, 상담자체에 불신감이나 불안을 느끼고 있는 내담자들에게 흥미를 주며, 상담에 대한 긍정적인 태도를 갖도록 하는 것이다. 이를 위하여, 상담자와 내담자 사이의 신뢰를 바탕으로 비밀이 보장되도록 하였다. 여러 사회 단체에서 운영하는 사이버 상담실은 이메일을 통해서만 비밀 상담할 수 있도록 설계되어 단회적인 상담으로 끝나는 경우가 많아 바람직한 상담관계가 성립될 수 없었다. 본고는 학교의 웹 서버를 활용하여 상담자와 내담자만이 상담 내용을 볼 수 있도록 비공개 상담시스템을 설계하고 적용 결과를 보고한다. 본 시스템을 적용한 결과 면대면 상담에 비하여 시․공간적 제약을 받지 않고 두려움 없이 상담할 수 있다는 장점 때문에 학생들이 많은 흥미를 갖고 참여하였음을 관찰할 수 있었다.",123.0,웹 기반 상담시스템의 설계와 적용,2001.0
수학과 기하영역 학습을 위한 온라인 RPG 교수 게임의 설계   일반적으로 학습을 게임과 접목한 프로그램들은 대부분 오프라인을 기반으로 제작되어왔다. 하지만 최근 인터넷 기술의 급격한 발달로 인하여 웹을 기반으로 한 학습 프로그램의 이용이 증가하고 있다. 이에 개인 학습을 위한 기존의 오프라인 게임을 온라인에 기반한 학습용 게임으로 제작한다면 보다 많은 학생들이 쉽게 교육용 게임을 접할 수 있으며 오프라인에서와는 달리 경쟁 및 보상 개념의 도입이 쉬우므로 학습자들의 학습 의욕 향상에도 도움이 될 것이다.  본 논문은 이러한 개념을 바탕으로 초등학교 수학과 도형수업을 수준에 맞게 학습할 수 있는 온라인 롤플레잉 게임을 설계하여 보았다. 초등학생을 위한 수학 온라인 롤플레잉게임은(Mathematical On-line Roll playing game for Elementary school student)은 기존의 온라인 롤플레잉게임의 특성을 학습의 요소와 대응시키고 개인의 학습 의욕을 학업 능력치 등으로 나타냄으로써 학습자들의 자발적인 학습을 유도하였다.,124.0,수학과 기하영역 학습을 위한 온라인 RPG 교수 게임의 설계,2001.0
