kor_full,no,title,year
"청소년의 인터넷 중독 문제 개선을 위한 상담 지원 시스템 모형 개발   본 연구에서는 상담 비전문가인 교사에게 상담 내용과 방법을 제공하여 인터넷 중독 문제를 가지고 있는 학생을 상담할 수 있도록 지원하는 시스템 모형을 개발하였다. 시스템은 상담 내용과 방법을 제공하는 상담 컨텐츠, 학생 정보와 상담 결과를 기록하고 조회할 수 있는 상담 지원, 인터넷 중독 진단 및 설문 평가를 위한 평가 지원의 세 가지 모듈로 구성된다. 개발된 시스템을 초․중등학교 교사 30명에게 실험 운영하여 인터넷 중독 문제가 있는 학생을 상담하여, 개발된 시스템 모형의 문제점을 분석하였으며, 그리고 상담에 참여한 교사들이 제기한 문제와 개선안을 토대로 시스템 모형을 수정하였다. ",235.0,청소년의 인터넷 중독 문제 개선을 위한 상담 지원 시스템 모형 개발,2004.0
"멀티미디어 동영상 강의 저작 도구 개발   본 연구는 사용자에게 편리한 사용자 인터페이스를 제공하는 멀티미디어 동영상 저작도구를 개발하여 가상 교육의 효율적인 환경을 제공하고자 한다. 각각의 멀티미디어 데이터를 하나의 동기화 된 멀티미디어 컨텐츠로 통합하여 저작하고 편집하기 위하여 멀티미디어 재생 속성들로부터 XML문서로 변환하는 방법을 제안하였다. 본 연구의 저작도구를 활용하여 동영상 강의를 손쉽게 저작할 수 있으며, 웹 문서로의 빠른 전환이 가능하다. ",236.0,멀티미디어 동영상 강의 저작 도구 개발,2004.0
"SW 적응력 향상을 위한 SW 교수.학습 전략   최근 ICT 교육의 활성화에 따라 응용 SW(Software) 교육의 중요성이 더해지고 있다. 그런데 지식의 기하급수적인 팽창과 컴퓨터 기술의 급속한 발전에 따라 끊임없이 새로운 SW가 양산되고 있기 때문에 기존의 SW 학습 패러다임은 여러 가지 문제에 봉착하였다. 본 연구는 이와 같은 문제의식을 가지고 문제 상황에서 학습자 스스로 SW의 적절한 기능을 쉽게 찾아 학습하고, 이를 문제 사태에 적용, 효율적으로 해결할 수 있으며, 파지와 전이를 촉진시킬 수 있는 능력을 SW 적응력이라 정의하고, 이를 배양할 수 있는 SW 교수․학습 방법을 탐색하였다. 이를 위해 SW 사용성과 UI(User Interface)디자인을 위한 원칙 등을 살펴보고, SW 적응력, UI 디자인 원칙에 따른 SW 학습 전략을 도출하였다. 또한 시범․실습식 SW 교수․학습 방법의 문제점을 살펴보고 SW 적응력 향상을 위한 탐구적 교수․학습 모형을 제안하였다.",237.0,SW 적응력 향상을 위한 SW 교수.학습 전략,2004.0
"초등학교 홈페이지에서의 불건전 정보 유통및 개인정보 노출 실태 분석   본 논문에서는 244개 국공립 초등학교 홈페이지를 직접 접속하여 불건전 정보 유통과 개인정보 노출 측면에서 학교 홈페이지의 안전 실태를 조사하였다. 홈페이지 게시판에 음란물과 상업성 광고들이 나타나는 학교가 62.7%에 달하였으며, 87.3%의 학교가 학생들의 사진, 주소, 전화번호와 같은 학생의 개인정보를 노출시키고 있었다. 분석 결과 불건전 정보의 유통은 대부분 자동등록 프로그램에 의한 것으로, 이는 무분별한 게시판 개설 및 부적절한 관리에 기인한다. 이와는 대조적으로 개인정보 노출은 교사와 학생들의 부주의한 정보관리에서 비롯되었다. 이것은 교사와 학생들이 개인정보 노출에 따른 위험성을 제대로 알지 못하고 있다는 것을 나타내는 것이다. 따라서 안전한 학교 홈페이지의 구축과 이용을 위해서는 먼저 실명에 의한 회원관리와 게시판 사용권한에 대한 통제가 강화되어야 한다. 그리고 현재 학교 홈페이지에 나타나는 역기능은 물론 잠재적 위험요인에 대한 교사의 올바른 인식이 필요하다.",238.0,초등학교 홈페이지에서의 불건전 정보 유통및 개인정보 노출 실태 분석,2004.0
정보통신기술교육의 교과전담제에 대한 초등 교사의 인식에 관한 연구   현재 정보통신기술교육(ICT)은 재량 수업으로 진행되고 있다. 이러한 ICT교육은 소양 교육으로 전환하기 위한 연구가 절실하다. 본 연구는 재량교과 내에서 이루어지고 있는 정보통신기술교육이 정상적으로 운영되기 위해 정보통신교육이 교과전담제로 운영되는 것에 대한 초등교사의 인식에 관한 연구이다. 설문의 결과에 따라 대부분의 교사가 정보통신교육을 교과전담제로의 운영하기를 요청하고 있는 것으로 분석되었다. 이러한 연구 결과를 통하여 재량교과 중 정보통신기술교육이 내실 있고 효율적인 운영이 될 수 있는 기초 자료를 제공하였다.,239.0,정보통신기술교육의 교과전담제에 대한 초등 교사의 인식에 관한 연구,2004.0
초등학교의 독서교육을 위한웹 기반 동료평가 시스템의 구현   독서를 통하여 높은 수준의 사고능력을 습득할 수 있으므로 독서능력은 모든 학생들이 갖추어야할 기본 능력으로 간주되고 있다. 또한 독서교육은 학생들에게 올바른 사고와 비판적 능력을 함양할 수 있다. 그러나 독서교육은 교사의 시간적 제약과 대응력의 부족으로 비중 있게 다루어지지 못했다. 이에 본 연구에서는 웹을 기반으로 하는 동료평가 시스템을 구현하여 독서교육에 활용하는 방안을 연구하였다. 학생들은 웹에서 자유롭게 독후감을 작성하고 다른 학생들이 쓴 독후감을 평가할 수 있다. 동료평가 과정은 단순히 점수화를 위한 것이 아니라 동료들의 평가와 조언을 활발하게 받아들이고 다른 사람의 글을 읽고 평가하면서 자신의 글에 대한 반성적 사고를 할 수 있다. 교사중심이 아닌 학습자중심의 활동으로 교사와 학습자 모두에게 유익을 주기 위함이다. 본 시스템을 초등학교 현장에 적용한 결과 학생들의 독서에 대한 태도와 선호도가 향상된 것으로 나타났다.,240.0,초등학교의 독서교육을 위한웹 기반 동료평가 시스템의 구현,2004.0
"학습동기 유발을 위한 아바타 활용 수업 개발   전 세계적으로 인터넷 활용인구가 급증하고 있다. 이러한 흐름에 부응하여 많은 사이트들이 제공하는 아바타는 강한 동기 부여와 만족감을 형성해줌으로서 성인이나 청소년들에게도 모두 인기를 얻고 있다. 이에 본 연구에서는 초등학교 6학년생들을 대상으로 학습자 스스로 꾸밀 수 있는 호감 가는 아바타를 활용한 수업을 설계하고 이를 실제 학습에 활용해 봄으로서 학생들의 학업 성취에 영향을 끼치는지를 살펴보고자 하였다. 연구 결과 국어, 수학, 사회, 과학의 각 교과에서 학습자의 학업 성취도에 영향을 주는 것으로 나타났다. ",241.0,학습동기 유발을 위한 아바타 활용 수업 개발,2004.0
