kor_full,no,title,year
"효율적 교수학습을 위한 웹 기반 수행평가 시스템 설계 및 구현   본 연구의 목적은 웹 기반 수행평가의 문제중심별 상황학습에 따른 제작, 실시, 채점 및 전송과정을 통하여 교수자의 현장운영 및 학습자의 자기주도적 학습과 상호작용 증진을 통한 교수-학습의 효과를 증대시키는데 있다. 이를 위해 학교현장의 효율적 운영과 학습효과를 위한 구성주의적 문제중심학습(PBL)과 웹 기반 학습공동체 중심의 상황학습을 반영한 웹기반 수행평가 설계모형을 개발하였다. 웹 기반 제작은 자동제작을 통해 문제중심의 자기주도적 학습이 이루어지며, 상황학습을 적용한 템플릿 제작에서는 구체적 사례 기반의 맥락에 따른 학습이 수행된다.",192.0,효율적 교수학습을 위한 웹 기반 수행평가 시스템 설계 및 구현,2004.0
컴퓨터보조 자기장학이 Flanders 주요수업언어지수 향상에 미치는 효과    ,193.0,컴퓨터보조 자기장학이 Flanders 주요수업언어지수 향상에 미치는 효과,2004.0
"초등학교 학생들을 위한 사이버 상담 시스템 사이버상담, 비밀상담, 사이버 상담시스템 정보화 사회가 우리에게 가져다준 초고속 정보통신망을 활용하여 기존의 면대면 상담형태를 탈피하여 사이버 상담시스템을 설계하고 적용하였다. 본 사이버 상담시스템의 특징은 통신수단을 매개로하여 상담을 실시하는 형태로, 시․공간을 초월하여 학생들이 가지고 있는 고민을 자유롭게 상담할 수 있으며 내담자를 위한 시스템을 설계함으로써 활발하고 적극적인 상호작용이 이루어지도록 하여, 평소 상담자체에 불신이나 거부감, 또는 막연한 불안을 가지고 있는 내담자들에게 상담에 대한 인식을 새롭게 바꾸어 흥미를 가지고 상담에 적극적으로 참여할 수 있도록 하였다. 인터넷상에 존재하는 많은 사이버 상담실은 이메일을 통해서만 비밀 상담할 수 있도록 설계되어 있어 단회적인 상담으로 끝나는 경우가 많은데, 본 논문은 이미 구축되어 있는 개인 홈페이지가 사용되는 웹 서버를 활용하여 상담자와 내담자만의 비공개 상담 형태를 포함하여 다양한 형태의 상담이 지속적으로 이루어지도록 사이버 상담시스템을 설계하였다.",194.0,초등학교 학생들을 위한 사이버 상담 시스템,2004.0
"인터넷 소프트웨어 제작을 위한 PDA용 원격교육시스템 개발   유비쿼터스 환경이 도래함에 따라 언제 어디서나 어떤 단말기를 통해서도 정보를 얻을 수 있는 환경이 제시되었고, 모바일 장비의 성능이 개선되어가면서 무선인터넷 환경을 기반으로 운영될 수 있는 솔루션의 수요가 점차 증가되고 있는 추세이다. 이에 본 논문에서는 무선인터넷 환경에 적응력 있게 대응하기 위한 원격 교육 솔루션을 개발하고자 하며 이를 위하여 다른 그래픽 포맷들과는 달리 해상도의 크기가 변경되더라도 고품질의 가독성을 유지할 수 있는 SWF를 이용하여 포켓 PC의 대역폭 및 해상도 문제를 해결한 원격교육시스템을 설계 및 구현하였다.",195.0,인터넷 소프트웨어 제작을 위한 PDA용 원격교육시스템 개발,2004.0
"재량활동시간을 이용한 ICT 활용교육의 현황 및 개선방안   제7차 교육과정은 국민공통기본 교과 수업에서 정보통신기술을 10% 이상 활용하도록 하는 목표를 제시하고 학년별로 주당 학습시간을 정하여 실시하도록 한다. 하지만 초등학교의 교육현장에서 보면, 아동들이 컴퓨터실에서 ICT 활용교육을 실시하기 위한 환경이 부족한 편이다. 교사들 또한 준비되어 있지 않아서 7차 교육과정의 실시에는 부족한 점이 많다. 이에 본 논문은 초등학교에서 실시하고 있는 ICT 교육의 실태를 파악하고 개선 방안 모색을 목적으로 초등교사들의 의견을 설문지를 통해 조사한다.",196.0,재량활동시간을 이용한 ICT 활용교육의 현황 및 개선방안,2004.0
"초등학교 과학 교구 관리시스템   최근 학교 현장에 인터넷의 보급과 함께 새로운 방식의 교육 형태와 학교 업무 전산화의 필요성이 대두되었다. 이에 따라 새로운 교육 방식으로서 ICT (Information & Communication Technology) 활용교육을 통한 다양한 교수-학습 모형이 시도되고 있으나, 학교 업무 전산화는 오프라인에서 종이문서를 단편적으로 입력하고 데이터를 출력하는 형태에 머물러 있다. 따라서 본 연구에서는 웹 기반의 업무처리 방식에 따른 초등학교 과학 교구 관리시스템을 제안한다. 본 시스템의 특징은 다음과 같다. 첫째, 학교에서 관리하는 과학 교구 관리업무를 시․도교육청 기준안에 따라 표준화, 정보화하고 또한 교육청의 교구기준에 따라 자료를 선정하여 업무의 효율성과 신속성을 증진시킨다. 둘째, 교구관리시스템을 기초 정보 관리, 교구 기준 관리, 교구 현황 관리 등으로 구성하여 필요한 정보를 쉽고 빠르게 파악할 수 있다. 셋째, 초등학교 교구기준에 맞추어 설계함으로써 기준량, 보유량 및 부족량의 파악과 교구확충계획을 효율적으로 수립하여 업무의 경감과 인력 및 시간의 낭비를 줄일 수 있다.",197.0,초등학교 과학 교구 관리시스템,2004.0
"교육정보 관리시스템 운영에 대한 초등학교 교직원의 의식 조사 연구   본 연구에서는 일선 초․중등학교에서 활용되고 있는 교육정보 관리시스템의 운영 실태를 파악하고 그 활용의 효과성에 대한 교직원들의 견해를 조사하였다. 특히, 새롭게 도입하려다가 많은 반대에 부딪혀 시행을 보류하고 있는 NEIS의 도입 가능성과 문제점에 대한 의식 실태를 중점적으로 조사하였다. 조사 방법은 설문지를 이용하였으며, 표집 대상을 시내 소재 학교와 시외 소재 학교, NEIS 시범 운영 학교와 비시범 운영 학교로 구분하여 표집 하였다. 수집된 자료의 분석은 각 항목별로 빈도와 백분율을 산출하였고 항목들간의 상관관계를 알아보기 위해 2검정을 실시하였다. 본 연구는 지금까지 도입되고 있는 교육정보 관리시스템의 운영 실태, 활용 효과, 문제점 등을 파악하고 개선점을 제언함으로써 향후 교육정보 관리시스템 운영에 도움을 줄 것으로 기대한다.",198.0,교육정보 관리시스템 운영에 대한 초등학교 교직원의 의식 조사 연구,2004.0
"정보통신윤리에 대한 초등 교사들의 인식수준 분석과 개선 방향에 관한 연구   본 연구는 학생들의 문제점을 가까이 접하고 있는 초등학교 현장 교사의 정보통신윤리 교육의 의식수준과 교육실태 분석을 통하여 정보통신윤리 교육의 활성화 방안을 제안하는데 목적이 있다. 즉, 정보통신 윤리 교육의 현황을 파악하고, 현재 실시되는 정보통신의 윤리 교육 상황에도 불구하고 발생되는 불건전한 정보의 유통, 게임 및 통신 중독, 정보의 오․남용 등의 역기능을 살펴본다. 한편, 미래를 이끌어 갈 아동의 교육을 책임지고 있는 학교현장의 교사를 대상으로 정보통신 윤리에 대한 의식수준을 조사한 후 이를 토대로 역기능을 줄이기 위한 학교에서의 정보통신 윤리교육 활성화 방안을 제안한다.",199.0,정보통신윤리에 대한 초등 교사들의 인식수준 분석과 개선 방향에 관한 연구,2004.0
"웹기반교육의 효과성 제고를 위한학습자 평가준거 개발   웹기반교육에서 학습의 주체는 학습자이다. 교육전문가나 전문적인 시스템 개발자가 효과적이라고 생각하는 웹기반교육을 학습자는 전혀 다르게 받아들여질 수 있다. 이에 본 연구는 학습자가 성공적인 웹기반교육이라고 인정하는 주요 조건들을 살펴보고자 하였다. 진행한 연구방법으로는 문헌분석을 통해 효과적인 웹기반 교육의 전략들을 총 35개의 준거들을 도출하여 설문조사한 후 요인분석을 실시하여 4개의 요인 28개의 평가준거들을 도출하였다. 연구결과에 따르면 학습자들은 의미있는 웹기반교육을 교수전략, 시스템편의성, 학습지원, 화면구성 등의 영역 안에서 평가함을 알 수 있었으며, 이러한 영역들의 효율성을 제고하기 위해서는 체제적 교수설계 전략을 통한 웹기반교육의 요구분석, 설계, 개발, 운영, 평가 등의 일련의 과정을 총실하게 따라야 할 것이다.",200.0,웹기반교육의 효과성 제고를 위한학습자 평가준거 개발,2004.0
"교원 원격 연수 시스템 분석을 통한 원격 연수 활성화 방안에 관한 연구   본 연구에서는 인터넷을 이용한 교원 정보화 원격 연수 시스템의 로그 정보를 분석하고, 연수자의 성적을 분석하였다. 분석 결과를 요약하면 다음과 같다. 첫째, 연수자의 대부분이 근무 시간대에 학교에서 접속하며, 시험 주간에는 일요일의 접속 회수가 현저하게 높게 나타났다. 둘째, 동료 교사와 함께 참여한 연수자는 그렇지 않은 연수자보다 온라인 평가의 성적과 이수율이 높게 나타났다. 그러나 온라인 평가 성적에 대한 낮은 배점으로 최종 성적에는 영향을 미치지 못하였다. 셋째, 온라인 평가의 배점 비율은 20∼30%가 적당하다. 넷째, 하위권의 연수자는 접속 회수가 높을수록 최종 성적이 높게 나타났다. 따라서 사전 평가를 통해서 그들의 능력을 미리 파악하고, 그것을 통해서 하위권 연수자에 대한 지속적인 관심과 독려가 필요하다.",201.0,교원 원격 연수 시스템 분석을 통한 원격 연수 활성화 방안에 관한 연구,2004.0
"온라인 논술시험 시스템의 설계 및 구현   본 논문에서는 실제 학생들이 논술시험을 치르는 것과 유사하게, 온라인 상에서 200자 원고지를 이용하여 논술을 작성하고 작성된 원고지 위에 첨삭지도를 할 수 있도록 하는 온라인 논술시험 시스템을 설계 및 구현하였다. 온라인 논술시험 시스템의 주요기능은 응시자가 주어진 논술문제에 대한 논술답안을 작성하여 원고지로 전환하여 제출하고, 채점자는 제출된 원고지 위에 직접 첨삭지도를 한다. 제안된 시스템에서 채점자는 펜 마우스와 타블렛을 이용하여 첨삭지도를 하고, 네트워크의 트래픽을 줄이기 위해서 원고지 그림을 JPEG형태로 압축하여 서버로 전송한다. 이 시스템은 비용이 적게 들고, 효율성, 사용성 면에서 상당한 이점이 있다. 나아가 온라인 주관식시험의 한 대안으로 발전 가능하리라 기대한다.",202.0,온라인 논술시험 시스템의 설계 및 구현,2004.0
"교사들의 ICT 활용 촉진 요인 분석 및 제언   정보화 사회로의 변화와 더불어 교육에서도 정보통신기술(ICT)의 활용을 보다 적극적으로 권장하고 있다. 이러한 ICT를 활용한 교육의 활성화를 위한 정부의 노력으로 현재 초,중등 학교의 교육 정보 인프라는 높은 수준으로 구축되었다. 이와 더불어 수업에 ICT의 보다 효과적인 효과적으로 하기 위한 방안에 대한 연구는 많이 있었으나 학교에서의 ICT활용을 촉진하는 요인들에 대한 연구는 상대적으로 부족했다. 그나마 이러한 연구들도 단순한 실태조사에 의한 문제점 지적과 개인의 제언들이 대부분이었으며 실질적으로 혁신의 확산과 수용이라는 이론적 배경에 근거한 분석과 제언은 거의 없었다. 이에 본 연구에서는 학교에서의 ICT활용 교육의 확산과 실행을 증진시키기 위한 방안을 제시하기 위해서 그동안의 ICT활용의 촉진과 방해 요인들에 관한 연구들을 살펴보고 그 연구들의 결과를 혁신의 확산과 수용이론과 촉진환경요인들과의 비교를 통해 분석하였다.",203.0,교사들의 ICT 활용 촉진 요인 분석 및 제언,2004.0
"ICT 소양능력 평가를 위한 WebCAT 시스템의 개발   정부에서는 지식정보화사회에 대비하여 정보통신을 위한 인프라를 구축하고 있으며, 이와 함께 정보통신기술 교육을 강화하고 있다. 그러나 정보통신 활용 교육을 위해서는 학습자들의 정보소양 능력이 전제가 되어야 하나, 이를 위한 체계적인 교육과정과 시간이 부족하기 때문에 많은 어려움이 지적되고 있다. 본 논문에서는 이러한 문제점을 해결하기 위하여 문항반응이론을 이용한 웹 기반의 컴퓨터 개별 적응평가 시스템을 개발하였다. 학습자들은 친숙한 웹 인터페이스를 이용하여 학교 또는 가정에서 자신의 정보소양 능력을 평가해 보고, 그 결과에 따라 보충 또는 심화학습을 함으로써 원활한 ICT 활용 교육이 이루어 질 수 있을 것이다. 또한 본 시스템은 현재 추진하고 있는 초·중·고 정보통신 소양 인증제를 위한 효과적인 평가 방법이 될 수 있을 것이다.",204.0,ICT 소양능력 평가를 위한 WebCAT 시스템의 개발,2004.0
주관식 평가를 위한 웹기반 온라인 평가 시스템의 구현 및 적용   우리 생활 전반은 인터넷 서비스의 확대 보급으로 많은 변화를 보이고 있으며 학교 현장 역시 인터넷과 학교 전산망이 설치되어 교육에 필요한 다양한 정보의 수집과 탐색이 용이해짐으로써 인터넷을 활용한 웹 기반 가상 수업 실시， 실시간 평가， 학습 진도 관리 등 새로운 형태의 교육 활동이 이루어지고 있다. 본 논문은 문제의 정답이 한가지로 이루어진 단답형 문제가 아니라 간단한 문장으로 이루어진 문제를 처리할 수 있는 웹 기반 온라인 주관식 문항 평가 시스템을 학습자의 성취 수준을 보다 빠르게 정확하게 알 수 있도록 하였다. 정확히 규정된 정답과 정확한 채점 기준이 있는 주관식 문제는 교사가 직접 채점하는 경우와 유사한 정확성을 가지고 있으며 채점 시간의 신속성이 매우 높아서 평가 결과의 실시간 피드백이 가능하여 주관식 문제를 평가하는데 그 효율성이 기대된다.,205.0,주관식 평가를 위한 웹기반 온라인 평가 시스템의 구현 및 적용,2004.0
"초등 정보과학영재들의 정보화 역기능 실태와 개선방안   컴퓨터와 정보통신 기술은 하루가 다르게 발달하고 있지만, 지식기반사회를 살아가는 데 필요한 시대정신은 갖추지 못하여 이로 인한 부정적인 현상은 점점 그 심각성을 더해가고 있다. 최근 교육기관과 사회 공공 기관에서 역기능의 심각성을 인식하고 정보통신윤리교육을 실시하고 있지는 하지만, 지식기반사회에서 국가적으로 매우 중요한 인재인 정보과학영재들에 대한 체계적인 정보통신윤리교육은 미미한 상태이다. 교육은 대상자의 수준에 맞게 이루어져야 효과적이다. 따라서 정보과학영재들에게는 그들에게 맞는 정보통신윤리교육이 필요할 것이다. 이와 같은 문제점을 인식하여 본 논문에서는 초등 정보과학영재들의 인터넷 이용실태를 분석한 후 초등 정보과학영재들을 위한 정보통신윤리교육방안을 제시하였다.",206.0,초등 정보과학영재들의 정보화 역기능 실태와 개선방안,2004.0
"초등학교에서의 정보통신기술 활용 실태 분석   교육정보화 종합계획의 1단계가 주로 인프라 기반 구축에 초점을 두었다면 2단계는 정보화의 물적 기반을 토대로 정보통신기술(ICT)의 활용을 통한 학생들의 창의력과 문제해결능력의 개발에 중점을 두고있다. 본 연구는 초등학교에 초점을 두고 인터넷 활용을 중심으로 학교에서의 ICT 활용 실태를 분석하고, 교육정보화 추진과정에서 보완해야 할 점이 무엇인가에 대한 시사점을 얻고자 하였다. 실태 분석을 위해서는 2003년 5월에 전국 규모로 설문조사를 실시하였으며, 총 310명의 교사가 설문에 응답하였다. 설문 조사는 ICT 활용 환경, 교사의 ICT 활용 능력, 수업을 위한 ICT 활용 방법, ICT 활용의 장애 요인 등과 같은 4가지 측면에서 이루어졌다. 실태분석 결과, 현재 학교에서 ICT를 활용하는 상황은 여러 측면에서 과거보다 상당히 개선되었으나, 교사들이 수업에서 ICT를 다양하게 활용하도록 지원하고, 연수 내용 및 방법을 체계화하는 등과 같은 해결해야 할 과제들이 있음을 발견할 수 있었다.",207.0,초등학교에서의 정보통신기술 활용 실태 분석,2004.0
"초등학교 정보 통신 기술 교과서 비교 분석 연구- 4학년 교과서를 중심으로 -   교과서는 학교 교육의 기본 교재이며, 교사가 사용할 수 있는 최고의 교육도구이다. 현재 정보 통신 기술 교육에 사용되고 있는 교과서는 교육감 인정도서로 되어 있어 각 시․도 별로 다른 교과서를 사용하고 있다. 본 연구에서는 시․도 별로 다른 정보 통신 기술 교과서를 분석한다. 11종의 4학년 교과서를 대상으로 교과서의 기본 현황, 교과서 내용 구성 체제, 교과서 내용을 비교 분석하였고, 교과서 내용이 탐구적 활동을 진술하고 있는지 Romey 분석법으로 분석하였다. 본 연구의 결과는 차기 검․인정 도서 개발을 위한 기초 자료이며, 정보 통신 기술 교육 활성화에 도움이 될 것이다.",208.0,초등학교 정보 통신 기술 교과서 비교 분석 연구- 4학년 교과서를 중심으로 -,2004.0
"VRML과 자바애플릿을 이용한 과학교육용 코스웨어   본 연구는 가상현실 언어인 VRML과 자바 애플릿을 이용하여 학습자(초등학교 고학년, 중학교 학생)에게 흥미를 줄 수 있는 향상된 학습 방법을 제공하고자 한다. 과학 교육의 현실적인 어려움을 극복하고자 VRML을 이용한 3차원 애니메이션 기능을 사용한다. 이를 통해, 우리 생활 속에 친숙한 기계 구조와 원리를 학습시키고 과학 학습의 흥미를 갖도록 한다. 앞으로 이와 같은 방법은 과학 교육의 효율성을 향상시키는데 널리 활용될 수 있다.",209.0,VRML과 자바애플릿을 이용한 과학교육용 코스웨어,2004.0
"「바른말 고운말 교실」 웹기반 학습시스템 개발 및 적용   컴퓨터의 보급과 네트워크 망의 확대로 인터넷 사용이 보편화되면서 인터넷을 이용하여 문자에 의존한 의사소통 방식이 음성이나 그림보다는 보편화되어 있다. 이에 따라 나타나는 통신 언어의 부작용으로 인해 계층 간의 이질화, 세대간의 의사소통 단절, 언어폭력, 청소년들의 심성발달 저해 등 많은 문제점을 야기시키고 있고, 비속어, 은어, 비어, 어문규범 일탈형의 표기로 어린이에 대한 국어 교육이나 실제 언어 생활에 부정적으로 작용하는 측면이 강하다. 이러한 문제를 해결하기 위하여 학생들의 요구분석을 통하여 「바른말 고운말 교실」이라는 웹기반 학습시스템을 개발하여 효과를 검증하기 위해 현장에 적용하였다. 적용 결과 많은 학생들에게 선호도와 교육적 효과가 높게 나타났으며 바른 언어 사용의 유의미한 결과가 나타났다.",210.0,「바른말 고운말 교실」 웹기반 학습시스템 개발 및 적용,2004.0
"영재 학급을 위한 사이버 상담 시스템 개발 및 적용   우리나라도 2003년부터 국가차원의 사업으로 추진하고 있는 영재 아동은 스스로 알아서 잘 하리라는 잘못된 생각으로 방치해두는 경우가 많으나 영재의 정서적 취약성으로 인하여 사회적 부적응, 우울증, 신경성 식욕 부진증 등과 같은 여러 가지 문제점이 발생한다. 따라서 본 논문에서는 영재들에게서 발생하는 정서적 취약성을 파악하고 문제점을 해결하기 위해 웹을 기반으로 하는 영재 사이버 상담 시스템을 설계 및 구현한다. 한편, 개발한 영재 사이버 상담 시스템에 대전 제6지구 지역공동 영재학급에 참여하고 있는 영재 아동들과 학부모를 적용하여 그 결과를 분석하였다. 분석 결과 영재 아동의 정서적 취약성을 상당부분 극복한 것을 알 수 있었고, 면대면 상담에서 부족했던 부분을 보완할 수 있었다.",211.0,영재 학급을 위한 사이버 상담 시스템 개발 및 적용,2004.0
"화상통신기술을 활용한 문제중심학습 시스템 설계 및 구현   정보통신기술의 발달로 교육환경에서도 많은 변화가 일어나 ICT 활용 교육을 통한 다양한 형태의 교수․학습 유형이 논의되고 있으며 최근에 급격히 발달하고 있는 인터넷을 활용한 원격교육이 급격히 확산되고 있는 실정이다. 하지만 교사가 일방적으로 과제를 제시하고 학생들은 인터넷 사이트를 활용하여 정보를 수집하여 가공하는 보여주기식에 그쳐 학생간 교사간의 상호작용이 부족하여 인터넷 활용 학습의 장점을 살리지 못하고 있다. 이에 본 연구에서는 웹과의 통합적 또는 보완적 차원에서 가장 적합하다고 여겨지는 구성주의의 문제중심학습 이론을 기반으로 하여 화상통신기술을 활용한 문제중심학습 환경을 구현하고 초등학교 현장에 적용하여 그 결과를 분석하였다. 그 결과 교사와 학습자간 학습자 동료 집단간의 상호작용에 효과가 있었으며 학습자의 수업에 대한 참여 태도 및 흥미, 집중력에 긍정적인 효과를 가져왔다. 또한 면대면 학습에서 부족했던 부분을 사이버 학습을 통해 보완할 수 있었으며 문제중심 학습모형의 장점을 살릴 수 있었다.",212.0,화상통신기술을 활용한 문제중심학습 시스템 설계 및 구현,2004.0
"초등학교 수.연산 영역 부진아를 위한웹기반 학습시스템의 설계 및 구현   수학과 수․연산 영역의 학습 부진은 위계성이 뚜렷한 수학과의 특성상 이전 학년에서 발생된 학습결손이나 이해의 부족이 다음 학년에서의 학습 방해나 장애로 이어져 결국 학습 부진을 증대시켜 학습 불능에까지 이르게 되는 등 심각한 문제로 대두되었다. 그러나 교사는 학급당 40여명의 학생지도, 과중한 잡무로 부진아의 개별 지도시간을 확보하기가 어려워 부진요인에 적합한 지도가 되지 못하고 있다. 또한 부진아의 평가 결과가 분석되어 관리되지 못하고 있기 때문에 부진아의 지도가 효과적으로 이루어지지 못하고 있다. 이러한 문제점을 해결하기 위하여 본 논문에서는 수․연산 영역 부진아의 학습 부진요소를 찾아내어 그에 맞는 적절한 학습을 제공하고 시간과 공간의 제약이 없이 시스템에 접근하여 학습할 수 있도록 하였다. 그리고 그 결과를 DB로 관리하여 부진아를 체계적으로 지도할 수 있도록 초등학교 수․연산 영역 부진아를 위한 웹기반 학습시스템을 구현하고 현장에 적용하여 그 결과를 분석하였다. 그 결과 교사들의 과중한 부담을 덜어 줄 수 있었으며 부진아들의 학습성취도를 높일 수 있었다.",213.0,초등학교 수.연산 영역 부진아를 위한웹기반 학습시스템의 설계 및 구현,2004.0
"초등학교 학습장애 학생의 수 개념 향상을 위한웹 코스웨어 개발   초등학교에서 학습장애를 갖고 있는 특수 학급의 학생들은 셈하기에 어려움을 갖고 있다. 셈하기의 기초가 되는 수 개념은 반복적 연습이 요구되며 컴퓨터를 활용한 학습은 학습자의 흥미나 학습에 집중하는 시간을 길어지게 한다. 따라서 학습장애 학생의 수 개념을 향상하기 위한 웹 코스웨어를 개발․적용하여 그 효과를 알아보았다. 본 연구에서 제안된 프로그램은 다양한 사고 활동을 통하여 학습자의 수 개념을 향상할 수 있도록 설계되었으며, 초등학교에 있는 특수 학급 학생 31명을 대상으로 실험 집단과 통제 집단으로 나누어 적용한 결과 수 개념 향상에 교육적 효과가 있었고 연산 능력 향상에도 긍정적인 반응을 유도하였다.",214.0,초등학교 학습장애 학생의 수 개념 향상을 위한웹 코스웨어 개발,2004.0
